{
  "schema_version": "1.0.0",
  "packet_id": "pr-163",
  "mode": "single",
  "target": {
    "base_branch": "main",
    "head_branch": "doc-001-static-docs-framework-and-ia-spike"
  },
  "source_feature_dir": "specs/doc-001-static-docs-framework-and-ia-spike",
  "generated_title": {
    "value": "docs(DOC-001): Select static docs framework and IA",
    "type": "docs",
    "scope": "DOC-001",
    "description": "Select static docs framework and IA",
    "source_evidence": {
      "kind": "feature_spec",
      "source": "specs/doc-001-static-docs-framework-and-ia-spike/spec.md",
      "summary": "DOC-001 feature title normalized into a public action phrase."
    },
    "rejected_candidates": [
      {
        "value": "Static docs framework and IA spike",
        "reason": "Feature display title is source evidence, not the final conventional title."
      },
      {
        "value": "doc-001-static-docs-framework-and-ia-spike",
        "reason": "Branch names remain metadata and are not title descriptions."
      }
    ]
  },
  "body_file": "specs/doc-001-static-docs-framework-and-ia-spike/.process/pr-body.md",
  "required_headings": [
    "Summary",
    "What Changed",
    "Why It Matters",
    "How To Review",
    "How To UAT",
    "Verification",
    "Scope",
    "Known Gaps"
  ],
  "verification_evidence": [
    {
      "kind": "packet_validation",
      "source": "speckit-pro/skills/speckit-autopilot/scripts/validate-pr-packet.sh",
      "summary": "PR packet validation passed for the DOC-001 title and body.",
      "result": "passed"
    },
    {
      "kind": "deterministic_suite",
      "source": "tests/speckit-pro/run-all.sh",
      "summary": "Deterministic SpecKit Pro suite was rerun after the main merge and packet refresh.",
      "result": "passed"
    },
    {
      "kind": "decision_update_validation",
      "source": "docs/ai/research/interactive-documentation-framework-spike.md",
      "summary": "2026-06-13 Astro/Starlight decision update passed Layer 1 structural validation, research-report default-stack scan, and git diff whitespace checks.",
      "result": "passed"
    }
  ],
  "scope_evidence": {
    "reviewable_loc": 0,
    "production_files": 0,
    "total_files": 32,
    "budget_result": "blocked",
    "changed_files": [
      ".specify/memory/archive-reports/2026-06-12-prsg-005-013-post-merge-hygiene.md",
      "docs/ai/research/interactive-documentation-framework-spike.md",
      "docs/ai/specs/.process/DOC-001-design-concept.md",
      "docs/ai/specs/.process/DOC-001-workflow.md",
      "docs/ai/specs/.process/autopilot-state.json",
      "docs/ai/specs/interactive-documentation-roadmap-MOC.md",
      "docs/ai/specs/interactive-documentation-technical-roadmap.md",
      "docs/prd-interactive-documentation.md",
      "docs/roadmap-interactive-documentation.md",
      "docs/traceability-interactive-documentation.md",
      "specs/doc-001-static-docs-framework-and-ia-spike/.process/atomicity-route.json",
      "specs/doc-001-static-docs-framework-and-ia-spike/.process/emission/full-verification-evidence.md",
      "specs/doc-001-static-docs-framework-and-ia-spike/.process/final-reviewability/changed-files.txt",
      "specs/doc-001-static-docs-framework-and-ia-spike/.process/final-reviewability/gate-state.json",
      "specs/doc-001-static-docs-framework-and-ia-spike/.process/marker-plan/final-marker-split-result.json",
      "specs/doc-001-static-docs-framework-and-ia-spike/.process/marker-plan/pr-marker-plan.json",
      "specs/doc-001-static-docs-framework-and-ia-spike/.process/pr-body.md",
      "specs/doc-001-static-docs-framework-and-ia-spike/.process/pr-packets/pr-163.json",
      "specs/doc-001-static-docs-framework-and-ia-spike/.process/pr-packets/pr-163/validation.json",
      "specs/doc-001-static-docs-framework-and-ia-spike/.process/reviewability/tasks-gate.json",
      "specs/doc-001-static-docs-framework-and-ia-spike/.process/uat-runbook.md",
      "specs/doc-001-static-docs-framework-and-ia-spike/SPEC-MOC.md",
      "specs/doc-001-static-docs-framework-and-ia-spike/checklists/accessibility.md",
      "specs/doc-001-static-docs-framework-and-ia-spike/checklists/documentation-quality.md",
      "specs/doc-001-static-docs-framework-and-ia-spike/checklists/error-handling.md",
      "specs/doc-001-static-docs-framework-and-ia-spike/checklists/requirements.md",
      "specs/doc-001-static-docs-framework-and-ia-spike/data-model.md",
      "specs/doc-001-static-docs-framework-and-ia-spike/plan.md",
      "specs/doc-001-static-docs-framework-and-ia-spike/quickstart.md",
      "specs/doc-001-static-docs-framework-and-ia-spike/research.md",
      "specs/doc-001-static-docs-framework-and-ia-spike/spec.md",
      "specs/doc-001-static-docs-framework-and-ia-spike/tasks.md"
    ],
    "non_goals": [
      "No docs-site scaffold, package file, lockfile, site config, CI workflow, README migration, marketplace update, generated payload, or plugin behavior change.",
      "The next implementation PR owns refreshing current framework and GitHub Pages documentation before scaffolding."
    ]
  },
  "uat": {
    "how_to_uat": "Review the research artifact and run the deterministic repository checks; no browser UAT applies because no docs site was scaffolded.",
    "uat_runbook_heading": "## UAT Runbook",
    "uat_source": "specs/doc-001-static-docs-framework-and-ia-spike/.process/pr-body.md"
  },
  "source_markers": [
    {
      "marker_id": "doc-001-spec",
      "rendered_text": "Source: DOC-001 specification and framework spike report define the selected stack and IA handoff.",
      "source": "specs/doc-001-static-docs-framework-and-ia-spike/spec.md"
    },
    {
      "marker_id": "framework-spike",
      "rendered_text": "Source: framework spike report and DOC-001 planning artifacts define the changed review surface.",
      "source": "docs/ai/research/interactive-documentation-framework-spike.md"
    },
    {
      "marker_id": "verification",
      "rendered_text": "Source: packet validation result and local verification output.",
      "source": "specs/doc-001-static-docs-framework-and-ia-spike/.process/pr-packets/pr-163/validation.json"
    }
  ],
  "editable_fields": [
    {
      "field_id": "summary",
      "heading": "Summary",
      "start_marker": "<!-- speckit-pro-editable:summary:start -->",
      "end_marker": "<!-- speckit-pro-editable:summary:end -->"
    },
    {
      "field_id": "what_changed",
      "heading": "What Changed",
      "start_marker": "<!-- speckit-pro-editable:what_changed:start -->",
      "end_marker": "<!-- speckit-pro-editable:what_changed:end -->"
    },
    {
      "field_id": "why_it_matters",
      "heading": "Why It Matters",
      "start_marker": "<!-- speckit-pro-editable:why_it_matters:start -->",
      "end_marker": "<!-- speckit-pro-editable:why_it_matters:end -->"
    }
  ],
  "protected_body_fingerprint": {
    "algorithm": "sha256",
    "value": "839b72991de710496aa2606051e2d1ad0d51ad24d2329ee7e020e0877f6f24af",
    "normalization": "canonical packet block only; LF line endings; trailing whitespace trimmed; final newline ensured; editable block bodies replaced by <elided:field_id> before sha256.",
    "elided_fields": [
      "summary",
      "what_changed",
      "why_it_matters"
    ]
  },
  "validation_result_path": "specs/doc-001-static-docs-framework-and-ia-spike/.process/pr-packets/pr-163/validation.json"
}
