{
  "schema_version": "1.0.0",
  "packet_id": "valid-single",
  "mode": "single",
  "target": {
    "base_branch": "main",
    "head_branch": "prsg-012-reviewer-ready-pr-packet-contract"
  },
  "source_feature_dir": "specs/prsg-012-reviewer-ready-pr-packet-contract",
  "generated_title": {
    "value": "feat(speckit-pro): Add reviewer-ready PR packets",
    "type": "feat",
    "scope": "speckit-pro",
    "description": "Add reviewer-ready PR packets",
    "source_evidence": {
      "kind": "feature_spec",
      "source": "specs/prsg-012-reviewer-ready-pr-packet-contract/spec.md",
      "summary": "Feature title normalized into a public action phrase."
    },
    "rejected_candidates": [
      {
        "value": "PRSG-012 reviewer packet contract",
        "reason": "Contains an internal feature identifier."
      },
      {
        "value": "prsg-012-reviewer-ready-pr-packet-contract",
        "reason": "Uses the branch name instead of reviewer-facing prose."
      }
    ]
  },
  "body_file": "tests/speckit-pro/layer4-scripts/fixtures/pr-packet/bodies/valid-single.md",
  "required_headings": [
    "Summary",
    "What Changed",
    "Why It Matters",
    "How To Review",
    "How To UAT",
    "Verification",
    "Scope",
    "Known Gaps"
  ],
  "verification_evidence": [
    {
      "kind": "json_syntax",
      "source": "tests/speckit-pro/layer4-scripts/fixtures/pr-packet/valid-single.json",
      "summary": "Fixture parses with jq empty.",
      "result": "passed"
    }
  ],
  "scope_evidence": {
    "reviewable_loc": 0,
    "production_files": 0,
    "total_files": 2,
    "budget_result": "within_budget",
    "changed_files": [
      "tests/speckit-pro/layer4-scripts/fixtures/pr-packet/valid-single.json",
      "tests/speckit-pro/layer4-scripts/fixtures/pr-packet/bodies/valid-single.md"
    ],
    "non_goals": [
      "Validator behavior is not implemented by this fixture task.",
      "Split-packet behavior is not covered by this single-packet fixture."
    ]
  },
  "uat": {
    "how_to_uat": "Run the Layer 4 packet validation fixture once the validator task lands. Until then, inspect the fixture shape and JSON syntax.",
    "uat_runbook_heading": "## UAT Runbook",
    "uat_source": "tests/speckit-pro/layer4-scripts/fixtures/pr-packet/bodies/valid-single.md"
  },
  "source_markers": [
    {
      "marker_id": "feature-spec",
      "rendered_text": "Source: feature specification defines reviewer packet sections.",
      "source": "specs/prsg-012-reviewer-ready-pr-packet-contract/spec.md"
    },
    {
      "marker_id": "schema-contract",
      "rendered_text": "Source: schema contract defines editable field markers.",
      "source": "specs/prsg-012-reviewer-ready-pr-packet-contract/contracts/pr-packet.schema.json"
    },
    {
      "marker_id": "quickstart-verification",
      "rendered_text": "Source: quickstart defines single-packet validation evidence.",
      "source": "specs/prsg-012-reviewer-ready-pr-packet-contract/quickstart.md"
    }
  ],
  "editable_fields": [
    {
      "field_id": "summary",
      "heading": "Summary",
      "start_marker": "<!-- speckit-pro-editable:summary:start -->",
      "end_marker": "<!-- speckit-pro-editable:summary:end -->"
    },
    {
      "field_id": "what_changed",
      "heading": "What Changed",
      "start_marker": "<!-- speckit-pro-editable:what_changed:start -->",
      "end_marker": "<!-- speckit-pro-editable:what_changed:end -->"
    },
    {
      "field_id": "why_it_matters",
      "heading": "Why It Matters",
      "start_marker": "<!-- speckit-pro-editable:why_it_matters:start -->",
      "end_marker": "<!-- speckit-pro-editable:why_it_matters:end -->"
    }
  ],
  "protected_body_fingerprint": {
    "algorithm": "sha256",
    "value": "f0a4e1862bdf1e6b59e6e8ca82675d5dfcb01878b3ebf5a8b5d239613bbd9394",
    "normalization": "LF line endings; trailing whitespace trimmed; final newline ensured; editable block bodies replaced by <elided:field_id> before sha256.",
    "elided_fields": [
      "summary",
      "what_changed",
      "why_it_matters"
    ]
  },
  "validation_result_path": "specs/prsg-012-reviewer-ready-pr-packet-contract/.process/pr-packets/valid-single/validation.json"
}
