{
  "schema_version": "1.0.0",
  "packet_id": "pr-packet",
  "mode": "single",
  "target": {
    "base_branch": "main",
    "head_branch": "doc-003-claude-code-marketplace-installation-path"
  },
  "source_feature_dir": "specs/doc-003-claude-code-marketplace-installation-path",
  "generated_title": {
    "value": "docs(DOC-003): add Claude Code install route",
    "type": "docs",
    "scope": "DOC-003",
    "description": "add Claude Code install route",
    "source_evidence": {
      "kind": "feature_spec",
      "source": "specs/doc-003-claude-code-marketplace-installation-path/spec.md",
      "summary": "DOC-003 title normalized into a public documentation action phrase."
    },
    "rejected_candidates": [
      {
        "value": "Claude Code Marketplace Installation Path",
        "reason": "Feature display title is source evidence, not the final conventional title."
      },
      {
        "value": "doc-003-claude-code-marketplace-installation-path",
        "reason": "Branch names remain metadata and are not title descriptions."
      }
    ]
  },
  "body_file": "specs/doc-003-claude-code-marketplace-installation-path/.process/pr-packet/pr-body.md",
  "required_headings": [
    "Summary",
    "What Changed",
    "Why It Matters",
    "How To Review",
    "How To UAT",
    "Verification",
    "Scope",
    "Known Gaps"
  ],
  "verification_evidence": [
    {
      "kind": "layer4_script",
      "source": "tests/speckit-pro/layer4-scripts/test-generate-pr-body.sh",
      "summary": "Docs-site validation covers the implemented Claude install route and internal links.",
      "result": "passed"
    }
  ],
  "scope_evidence": {
    "reviewable_loc": 0,
    "production_files": 0,
    "total_files": 23,
    "budget_result": "within_budget",
    "changed_files": [
      "AGENTS.md",
      "README.md",
      "docs-site/src/content/docs/install/claude-code.md",
      "docs/ai/specs/.process/DOC-003-design-concept.md",
      "docs/ai/specs/.process/DOC-003-workflow.md",
      "docs/ai/specs/.process/autopilot-state.json",
      "docs/ai/specs/interactive-documentation-roadmap-MOC.md",
      "docs/ai/specs/interactive-documentation-technical-roadmap.md",
      "speckit-pro/README.md",
      "specs/doc-003-claude-code-marketplace-installation-path/.process/reviewability/hazard-route.json",
      "specs/doc-003-claude-code-marketplace-installation-path/.process/reviewability/tasks-gate.json",
      "specs/doc-003-claude-code-marketplace-installation-path/SPEC-MOC.md",
      "specs/doc-003-claude-code-marketplace-installation-path/checklists/accessibility.md",
      "specs/doc-003-claude-code-marketplace-installation-path/checklists/error-handling.md",
      "specs/doc-003-claude-code-marketplace-installation-path/checklists/requirements.md",
      "specs/doc-003-claude-code-marketplace-installation-path/checklists/security.md",
      "specs/doc-003-claude-code-marketplace-installation-path/checklists/ux.md",
      "specs/doc-003-claude-code-marketplace-installation-path/data-model.md",
      "specs/doc-003-claude-code-marketplace-installation-path/plan.md",
      "specs/doc-003-claude-code-marketplace-installation-path/quickstart.md",
      "specs/doc-003-claude-code-marketplace-installation-path/research.md",
      "specs/doc-003-claude-code-marketplace-installation-path/spec.md",
      "specs/doc-003-claude-code-marketplace-installation-path/tasks.md"
    ],
    "non_goals": [
      "No Codex install, verification, cache, sandbox, approval, custom-agent, or runtime recovery procedure is added to the Claude route.",
      "No plugin runtime behavior, generated payloads, manifests, hooks, agents, versions, release automation, package files, or lockfiles are changed.",
      "Full troubleshooting, rollback, incident response, policy design, network debugging, and permission repair remain deferred to DOC-008."
    ]
  },
  "uat": {
    "how_to_uat": "Run pnpm --dir docs-site validate and inspect the Claude install route for install, lifecycle, recovery, trust, and boundary coverage.",
    "uat_runbook_heading": "## UAT Runbook",
    "uat_source": "specs/doc-003-claude-code-marketplace-installation-path/.process/pr-packet/pr-body.md"
  },
  "source_markers": [
    {
      "marker_id": "feature-spec",
      "rendered_text": "Source: feature specification defines reviewer-ready PR packet behavior.",
      "source": "specs/doc-003-claude-code-marketplace-installation-path/spec.md"
    },
    {
      "marker_id": "schema-contract",
      "rendered_text": "Source: schema contract defines editable field markers.",
      "source": "speckit-pro/skills/speckit-autopilot/contracts/pr-packet.schema.json"
    },
    {
      "marker_id": "quickstart-verification",
      "rendered_text": "Source: quickstart defines single-packet validation evidence.",
      "source": "specs/doc-003-claude-code-marketplace-installation-path/quickstart.md"
    }
  ],
  "editable_fields": [
    {
      "field_id": "summary",
      "heading": "Summary",
      "start_marker": "<!-- speckit-pro-editable:summary:start -->",
      "end_marker": "<!-- speckit-pro-editable:summary:end -->"
    },
    {
      "field_id": "what_changed",
      "heading": "What Changed",
      "start_marker": "<!-- speckit-pro-editable:what_changed:start -->",
      "end_marker": "<!-- speckit-pro-editable:what_changed:end -->"
    },
    {
      "field_id": "why_it_matters",
      "heading": "Why It Matters",
      "start_marker": "<!-- speckit-pro-editable:why_it_matters:start -->",
      "end_marker": "<!-- speckit-pro-editable:why_it_matters:end -->"
    }
  ],
  "protected_body_fingerprint": {
    "algorithm": "sha256",
    "value": "cffec9096c69a0b3cc28e02252fc26c1056bf77f87044b250fe085beb1470bf1",
    "normalization": "canonical packet block only; LF line endings; trailing whitespace trimmed; final newline ensured; editable block bodies replaced by <elided:field_id> before sha256.",
    "elided_fields": [
      "summary",
      "what_changed",
      "why_it_matters"
    ]
  },
  "validation_result_path": "specs/doc-003-claude-code-marketplace-installation-path/.process/pr-packets/pr-packet/validation.json"
}
